{
  "$schema": "https://json-schema.org/draft/2020-12/schema",
  "$id": "https://raw.githubusercontent.com/VapiAI/skills/main/schemas/skills.manifest.schema.json",
  "title": "Vapi Skills Manifest",
  "type": "object",
  "additionalProperties": false,
  "required": ["schemaVersion", "name", "description", "repository", "skills"],
  "properties": {
    "$schema": {
      "type": "string"
    },
    "schemaVersion": {
      "type": "string"
    },
    "name": {
      "type": "string",
      "minLength": 1
    },
    "description": {
      "type": "string",
      "minLength": 1
    },
    "repository": {
      "type": "object",
      "additionalProperties": false,
      "required": ["owner", "name", "defaultBranch", "htmlUrl", "rawBaseUrl"],
      "properties": {
        "owner": {
          "type": "string",
          "minLength": 1
        },
        "name": {
          "type": "string",
          "minLength": 1
        },
        "defaultBranch": {
          "type": "string",
          "minLength": 1
        },
        "htmlUrl": {
          "type": "string",
          "format": "uri"
        },
        "rawBaseUrl": {
          "type": "string",
          "format": "uri"
        }
      }
    },
    "skills": {
      "type": "array",
      "minItems": 1,
      "items": {
        "$ref": "#/$defs/skill"
      }
    }
  },
  "$defs": {
    "path": {
      "type": "string",
      "pattern": "^[A-Za-z0-9._/-]+$",
      "not": {
        "anyOf": [
          { "pattern": "^/" },
          { "pattern": "(^|/)\\.\\.(/|$)" }
        ]
      }
    },
    "reference": {
      "type": "object",
      "additionalProperties": false,
      "required": ["name", "path", "rawUrl"],
      "properties": {
        "name": {
          "type": "string",
          "minLength": 1
        },
        "path": {
          "$ref": "#/$defs/path"
        },
        "rawUrl": {
          "type": "string",
          "format": "uri"
        }
      }
    },
    "skill": {
      "type": "object",
      "additionalProperties": false,
      "required": ["name", "title", "description", "path", "rawUrl", "tags", "references"],
      "properties": {
        "name": {
          "type": "string",
          "pattern": "^[a-z0-9][a-z0-9-]*$"
        },
        "title": {
          "type": "string",
          "minLength": 1
        },
        "description": {
          "type": "string",
          "minLength": 1
        },
        "path": {
          "$ref": "#/$defs/path"
        },
        "rawUrl": {
          "type": "string",
          "format": "uri"
        },
        "tags": {
          "type": "array",
          "items": {
            "type": "string",
            "pattern": "^[a-z0-9][a-z0-9-]*$"
          }
        },
        "references": {
          "type": "array",
          "items": {
            "$ref": "#/$defs/reference"
          }
        }
      }
    }
  }
}
